{
  "$schema": "./inventory-summary-schema.json",
  "inventory_version": 1,
  "reviewed_on": "2026-08-20",
  "total_records": 52,
  "review_scope": "capability identifiers and paths only",
  "content_opened": false,
  "text_copied": false,
  "implementation_reused": false,
  "dispositions": [
    {"disposition": "covered", "count": 3},
    {"disposition": "partial", "count": 1},
    {"disposition": "public_candidate", "count": 25},
    {"disposition": "private_overlay", "count": 1},
    {"disposition": "rejected", "count": 22}
  ],
  "domains": [
    {"domain": "engineering lifecycle", "count": 14},
    {"domain": "engineering quality", "count": 3},
    {"domain": "plugin security", "count": 1},
    {"domain": "stack profiles", "count": 5},
    {"domain": "operating workflows", "count": 8},
    {"domain": "vendor or platform specialization", "count": 20},
    {"domain": "brand identity", "count": 1}
  ],
  "reconciliation": {
    "private_ledger_records": 52,
    "status": "matched"
  }
}
